run,unit_op_id,text,cluster_label
20241209_001652_corn stover_to_ethanol_(20),waste_management,"Waste Management: The process generates various waste streams, including lignin-rich residues and stillage. These by-products are managed through waste treatment processes, which may include anaerobic digestion to produce biogas or combustion to generate energy for the plant. Proper waste management is crucial for the sustainability and economic viability of the process.",6
20241209_001652_corn stover_to_ethanol_(20),raw corn stover source,"Raw Corn Stover Source: This unit operation serves as the source for the Raw Corn Stover stream, which is collected corn stover from agricultural fields. The stream is primarily composed of cellulose (40-50%), hemicellulose (25-30%), and lignin (15-20%). It is provided at an industrial scale of 100,000 metric tons per year, and is the initial feedstock required for subsequent processing steps in the production of ethanol.",0
20241209_001652_corn stover_to_ethanol_(20),dilute acid solution source,"Dilute Acid Solution Source: This unit operation serves as a source for the Dilute Acid Solution, which is essential for the pretreatment process in the conversion of biomass to ethanol. The dilute acid solution consists primarily of water and a specific acid, which facilitates the hydrolysis of lignocellulosic materials, enhancing the efficiency of subsequent enzymatic hydrolysis. This source is designed to supply the required volume of dilute acid solution at an industrial scale, ensuring consistent and reliable operation in the overall process flow.",12
20241209_001652_corn stover_to_ethanol_(20),cellulase enzymes source,"Cellulase Enzymes Source: This unit operation serves as a source for cellulase enzymes, which are critical for the enzymatic hydrolysis process. These enzymes catalyze the breakdown of cellulose into glucose, enabling the subsequent fermentation step to produce ethanol. The cellulase enzymes are supplied in a concentrated form to ensure optimal efficiency in the hydrolysis process.",5
20241209_001652_corn stover_to_ethanol_(20),yeast culture source,"Yeast Culture Source: This unit operation serves as the source for the Yeast Culture stream, which consists of microorganisms specifically cultivated for the fermentation process. The Yeast Culture is essential for converting the sugar-rich hydrolysate into ethanol during fermentation. It ensures a consistent and viable population of yeast is supplied to the fermentation unit operation, facilitating efficient ethanol production.",11
20241209_001652_corn stover_to_ethanol_(20),anhydrous ethanol sink,"Anhydrous Ethanol Sink: This unit operation serves as the final sink for the Anhydrous Ethanol stream, which is a high-purity ethanol product suitable for blending with gasoline. The stream contains primarily ethanol with minimal impurities, ensuring that it meets the fuel-grade specifications required for commercial use. This sink represents the endpoint of the ethanol production process, where the anhydrous ethanol is collected and prepared for distribution.",1
20241209_001652_corn stover_to_ethanol_(20),waste treatment sink,"Waste Treatment Sink: This unit operation serves as the final sink for the treated waste stream, which consists of processed waste materials including biogas and ash. The treated waste is managed to minimize environmental impact, ensuring that biogas can be utilized for energy recovery while ash can be disposed of or repurposed safely. This operation is critical for maintaining sustainability in the overall process by effectively handling waste products.",7
20241209_001652_corn stover_to_ethanol_(20),lignin and degradation products sink,"Lignin and Degradation Products Sink: This unit operation serves as a sink for the stream of lignin and degradation products generated during the pretreatment process. It is designed to collect and manage the byproducts, including lignin, furfural, and hydroxymethylfurfural (HMF), ensuring that these components are handled appropriately to minimize their impact on downstream processes. The operation may involve further treatment or disposal strategies to mitigate any potential negative effects on the overall production system.",14
20241209_001652_corn stover_to_ethanol_(3),feedstock_handling_and_preparation,"Feedstock Handling and Preparation: The initial step involves the collection and preparation of corn stover, which is a lignocellulosic biomass. This step includes the transportation of corn stover to the processing facility, followed by size reduction through mechanical means such as shredding or milling. The purpose of size reduction is to increase the surface area of the biomass, making it more amenable to subsequent chemical reactions. The prepared biomass is then conveyed to the pretreatment section.",13
20241209_001652_corn stover_to_ethanol_(3),pretreatment,"Pretreatment: The pretreatment step is designed to break down the complex structure of lignocellulosic biomass, making cellulose and hemicellulose more accessible for enzymatic hydrolysis. This is typically achieved using chemical methods such as dilute acid or alkaline treatment, which disrupts the lignin structure and solubilizes hemicellulose. The pretreatment process is critical for improving the yield of fermentable sugars in subsequent steps.",4
20241209_001652_corn stover_to_ethanol_(3),enzymatic_hydrolysis,"Enzymatic Hydrolysis: In this step, enzymes are added to the pretreated biomass to hydrolyze cellulose and hemicellulose into fermentable sugars, primarily glucose and xylose. The enzymatic hydrolysis is a critical step that determines the efficiency of sugar conversion, impacting the overall yield of ethanol. The process typically involves the use of cellulase and hemicellulase enzymes.",5
20241209_001652_corn stover_to_ethanol_(3),fermentation,"Fermentation: The fermentation process involves the conversion of fermentable sugars into ethanol by microbial action. Yeast, such as Saccharomyces cerevisiae, is commonly used for this purpose. The fermentation is carried out in large bioreactors where conditions are optimized for microbial growth and ethanol production. This step is crucial for determining the final ethanol yield and purity.",2
20241209_001652_corn stover_to_ethanol_(3),distillation,"Distillation: Distillation is employed to separate ethanol from the fermentation broth. This involves heating the broth to vaporize ethanol, which is then condensed and collected as a concentrated product. The distillation process is designed to achieve the desired purity of ethanol, typically 99.5% for fuel-grade applications. This step is energy-intensive and a major cost driver in the process.",9
20241209_001652_corn stover_to_ethanol_(3),dehydration,Dehydration: The dehydration step involves the removal of residual water from crude ethanol to achieve the high purity required for fuel-grade ethanol. This is typically done using molecular sieves or azeotropic distillation. The dehydration process ensures that the ethanol meets ASTM D4806 specifications for use as a biofuel.,3
20241209_001652_corn stover_to_ethanol_(3),waste_management,"Waste Management: This step involves the treatment and disposal of waste streams generated throughout the process, including stillage and any solid residues. Waste management is crucial for minimizing environmental impact and ensuring regulatory compliance. Solid residues may be used as animal feed or for energy recovery, while liquid waste is treated to remove contaminants before discharge.",6
20241209_001652_corn stover_to_ethanol_(3),raw corn stover source,"Raw Corn Stover Source: This unit operation serves as the source for the Raw Corn Stover stream, which is collected from agricultural fields. The stream consists of various components including cellulose, hemicellulose, lignin, ash, and moisture. It is a key feedstock for the subsequent processes in the production of ethanol, providing the necessary lignocellulosic biomass that requires handling and preparation before further processing.",0
20241209_001652_corn stover_to_ethanol_(3),enzyme solution source,"Enzyme Solution Source: This unit operation serves as a source for the Enzyme Solution, which contains cellulase and hemicellulase enzymes. These enzymes are crucial for the enzymatic hydrolysis process, where they catalyze the breakdown of complex carbohydrates in the pretreated biomass into fermentable sugars. The Enzyme Solution is prepared to ensure optimal activity and concentration of the enzymes, facilitating efficient conversion of biomass into sugars for subsequent fermentation.",5
20241209_001652_corn stover_to_ethanol_(3),yeast culture source,"Yeast Culture Source: This unit operation serves as a source for the Yeast Culture stream, which consists of Saccharomyces cerevisiae yeast cells. The yeast culture is critical for the fermentation process, where it converts fermentable sugars into ethanol. The operation ensures a consistent and viable supply of yeast cells to maintain optimal fermentation conditions.",11
20241209_001652_corn stover_to_ethanol_(3),fuel_grade ethanol sink,"Fuel-Grade Ethanol Sink: This unit operation serves as the final sink for the Fuel-Grade Ethanol stream, which is produced through the dehydration of crude ethanol. The Fuel-Grade Ethanol is characterized by its high purity (99.5%) and is specifically designed for use as a biofuel, complying with ASTM D4806 specifications. This sink ensures the collection and storage of the ethanol product, ready for distribution and use in various applications as a renewable energy source.",1
20241209_001652_corn stover_to_ethanol_(3),treated wastewater sink,"Treated Wastewater Sink: This unit operation serves as the final sink for the treated wastewater stream, which consists primarily of water that has undergone treatment to remove contaminants. The treated wastewater is suitable for discharge into the environment or for potential reuse in various applications, thereby contributing to sustainable water management practices within the industrial process.",7
20241209_001652_corn stover_to_ethanol_(3),solid residues sink,"Solid Residues Sink: This unit operation serves as a sink for the Solid Residues stream, which consists of lignin and yeast cells. The solid byproducts generated from the waste management process can be utilized for various applications, including animal feed or energy recovery. The sink ensures proper handling and storage of these residues, facilitating their potential reuse and minimizing waste in the overall process.",7
20241209_001652_corn stover_to_ethanol_(3),chemical agent source,"Chemical Agent Source: This unit operation serves as a source for the Chemical Agent stream, which consists of dilute acid and alkali. These chemical agents are essential in the pretreatment process of lignocellulosic biomass, specifically targeting the breakdown of lignin and the solubilization of hemicellulose. The proper formulation and delivery of these agents are critical for optimizing the efficiency of the pretreatment stage, ensuring that the biomass is adequately prepared for subsequent enzymatic hydrolysis.",12
20241209_001652_corn stover_to_ethanol_(3),gaseous emissions sink,Gaseous Emissions Sink: This unit operation serves as a sink for gaseous emissions generated during the pretreatment process of biomass. It is designed to capture and manage byproducts such as carbon dioxide and volatile compounds released during the breakdown of biomass. Proper handling and treatment of these emissions are crucial to minimize environmental impact and comply with regulatory standards.,8
20241209_001652_corn stover_to_ethanol_(3),dehydrated water sink,"Dehydrated Water Sink: This unit operation serves as a sink for the dehydrated water stream, which is the byproduct of the dehydration process used to purify crude ethanol into fuel-grade ethanol. The dehydrated water stream consists primarily of water and is typically disposed of or treated for reuse in other processes within the facility.",1
20241209_001652_corn stover_to_ethanol_(4),feedstock_handling_and_preparation,"Feedstock Handling and Preparation: The corn stover, which is a lignocellulosic biomass, is first collected and transported to the processing facility. Here, it undergoes size reduction through mechanical means such as milling or grinding to increase the surface area for subsequent processing steps. This step is crucial to ensure efficient downstream processing by facilitating better penetration of chemicals and enzymes during pretreatment and hydrolysis.",13
20241209_001652_corn stover_to_ethanol_(4),pretreatment,"Pretreatment: The prepared corn stover is subjected to a pretreatment process to break down the lignin structure and make the cellulose and hemicellulose more accessible for enzymatic hydrolysis. This can be achieved through various methods such as dilute acid pretreatment, steam explosion, or ammonia fiber expansion. The choice of method depends on factors like cost, efficiency, and environmental impact.",4
20241209_001652_corn stover_to_ethanol_(4),enzymatic_hydrolysis,"Enzymatic Hydrolysis: The pretreated biomass is then subjected to enzymatic hydrolysis where specific enzymes, primarily cellulases and hemicellulases, are added to convert cellulose and hemicellulose into fermentable sugars such as glucose and xylose. This step is critical for maximizing sugar yield, which directly impacts ethanol production efficiency.",5
20241209_001652_corn stover_to_ethanol_(4),fermentation,"Fermentation: The sugar solution is then fermented using microorganisms such as yeast or genetically engineered bacteria that can convert both glucose and xylose into ethanol. This biological conversion is a key step in the process, as it determines the overall yield and productivity of ethanol.",2
20241209_001652_corn stover_to_ethanol_(4),distillation,Distillation: The fermentation broth is subjected to distillation to separate ethanol from the mixture. Distillation exploits the difference in boiling points to concentrate ethanol to a high purity level suitable for fuel applications. This step is energy-intensive and requires careful design to ensure efficiency and cost-effectiveness.,9
20241209_001652_corn stover_to_ethanol_(4),dehydration,"Dehydration: The crude ethanol is further dehydrated to remove any remaining water content, achieving the fuel-grade purity of 99.5% ethanol. This is typically done using molecular sieves or azeotropic distillation techniques. The removal of water is crucial to meet the specifications for automotive fuel applications.",3
20241209_001652_corn stover_to_ethanol_(4),waste_treatment_and_management,"Waste Treatment and Management: The stillage and other waste streams generated throughout the process are treated to minimize environmental impact. This may involve anaerobic digestion to produce biogas, which can be used as an energy source, or other methods to recover valuable by-products or nutrients. Proper waste management is essential for the sustainability and economic viability of the process.",6
20241209_001652_corn stover_to_ethanol_(4),raw corn stover source,"Raw Corn Stover Source: This unit operation serves as the source for Raw Corn Stover, which is collected from agricultural fields. The stream consists of a mixture of cellulose, hemicellulose, lignin, ash, and moisture, typically requiring pretreatment to break down cellulose and hemicellulose into fermentable sugars. The feedstock is essential for the subsequent processes in the production of fuel-grade ethanol.",0
20241209_001652_corn stover_to_ethanol_(4),enzyme source,"Enzyme Source: This unit operation serves as a source for the enzyme stream, providing a mixture of cellulase and hemicellulase enzymes essential for the enzymatic hydrolysis of pretreated biomass. The enzymes facilitate the breakdown of cellulose and hemicellulose into fermentable sugars, which are critical for the subsequent fermentation process in the production of ethanol.",5
20241209_001652_corn stover_to_ethanol_(4),microorganism source,"Microorganism Source: This unit operation serves as a source for the 'Microorganisms' stream, providing essential yeast and bacteria that are capable of fermenting sugars into ethanol during the fermentation process. The microorganisms are cultivated and harvested to ensure a consistent and viable population for optimal fermentation efficiency.",11
20241209_001652_corn stover_to_ethanol_(4),fuel_grade ethanol sink,"Fuel-grade Ethanol Sink: This unit operation serves as the final sink for the Fuel-grade Ethanol stream, which is produced at a purity of 99.5%. It is designed to receive the finished ethanol product, ensuring that it meets the required specifications for automotive fuel applications. The sink facilitates the storage and distribution of the ethanol, ready for transportation to end-users or blending with gasoline.",1
20241209_001652_corn stover_to_ethanol_(4),treated waste sink,"Treated Waste Sink: This unit operation serves as the final sink for the treated waste stream, which includes processed waste materials with reduced environmental impact. The stream consists of biogas and nutrient-rich residues, which can be utilized for energy recovery or as fertilizers. This operation ensures safe disposal and management of waste, aligning with sustainability goals in the industrial process.",7
20241209_001652_corn stover_to_ethanol_(4),pretreatment chemicals source,"Pretreatment Chemicals Source: This unit operation serves as a source for the Pretreatment Chemicals required in the pretreatment process of biomass. The chemicals include acids, ammonia, and steam, which are essential for breaking down the lignin structure and enhancing the accessibility of cellulose and hemicellulose. The specific type and concentration of these chemicals can vary based on the selected pretreatment method, ensuring optimal conditions for the subsequent enzymatic hydrolysis and fermentation processes.",12
20241209_001652_corn stover_to_ethanol_(4),waste gas treatment sink,"Waste Gas Treatment Sink: This unit operation serves as a sink for the waste gases generated during the pretreatment process. It is designed to collect and manage gaseous by-products, including carbon dioxide (CO2), volatile organic compounds (VOCs), and steam. The waste gas treatment sink may incorporate technologies for gas scrubbing, condensation, or combustion to mitigate environmental impact and recover energy where feasible. Proper management of these gases is crucial for compliance with environmental regulations and for optimizing overall process efficiency.",8
20241209_001652_corn stover_to_ethanol_(4),water sink,"Water Sink: This unit operation serves as a sink for the water removed during the dehydration process of crude ethanol. It collects and manages the water byproduct generated to achieve the desired purity of fuel-grade ethanol, ensuring efficient waste management and compliance with environmental regulations.",1
20241209_001652_corn stover_to_ethanol_(5),feedstock_preparation,"Feedstock Preparation: The corn stover, which is primarily composed of cellulose, hemicellulose, and lignin, is first collected and transported to the processing facility. Here, it undergoes size reduction through mechanical milling to increase the surface area, facilitating subsequent chemical reactions. The moisture content is adjusted to optimal levels for pretreatment, typically around 10-15%.",13
20241209_001652_corn stover_to_ethanol_(5),pretreatment,"Pretreatment: The prepared corn stover is subjected to a pretreatment process to break down the lignocellulosic structure, making cellulose and hemicellulose more accessible for enzymatic hydrolysis. This is typically achieved using dilute acid hydrolysis, which involves treating the biomass with a dilute acid solution to solubilize hemicellulose and partially disrupt the lignin structure.",4
20241209_001652_corn stover_to_ethanol_(5),enzymatic_hydrolysis,"Enzymatic Hydrolysis: The pretreated biomass is then subjected to enzymatic hydrolysis, where cellulase enzymes are added to convert cellulose into fermentable sugars, primarily glucose. This step is crucial for maximizing sugar yield, which directly impacts ethanol production efficiency.",5
20241209_001652_corn stover_to_ethanol_(5),fermentation,Fermentation: The hydrolysate is then fermented using yeast or other microorganisms to convert the glucose into ethanol. This biological process is carried out in fermenters under controlled conditions to maximize ethanol yield while minimizing by-product formation.,2
20241209_001652_corn stover_to_ethanol_(5),distillation,Distillation: The fermentation broth is subjected to distillation to separate ethanol from water and other components. This step involves multiple distillation columns to achieve the desired fuel-grade ethanol purity of at least 99.5%.,9
20241209_001652_corn stover_to_ethanol_(5),dehydration,"Dehydration: The ethanol from the distillation step is further dehydrated to remove any remaining water, typically using molecular sieves or other advanced dehydration technologies, to achieve the anhydrous ethanol specification required for fuel blending.",3
20241209_001652_corn stover_to_ethanol_(5),raw corn stover source,"Raw Corn Stover Source: This unit operation serves as the source for the Raw Corn Stover stream, which consists of collected corn stover with its natural moisture content. The stream is primarily composed of cellulose, hemicellulose, lignin, and water, making it suitable for subsequent processing in the feedstock preparation unit. The source is designed to handle a volumetric scale of 100,000 metric tons per year, ensuring a consistent supply of raw material for the bioethanol production process.",0
20241209_001652_corn stover_to_ethanol_(5),dilute acid solution source,"Dilute Acid Solution Source: This unit operation serves as the source for the Dilute Acid Solution, which is a critical component in the pretreatment process of biomass. The solution is utilized to hydrolyze hemicellulose and disrupt lignin structures in prepared corn stover, enhancing the efficiency of subsequent enzymatic hydrolysis. The unit operation ensures a consistent supply of the dilute acid solution, maintaining the necessary concentration and flow rate for optimal pretreatment performance.",12
20241209_001652_corn stover_to_ethanol_(5),cellulase enzyme source,"Cellulase Enzyme Source: This unit operation serves as a source for Cellulase Enzymes, which are critical for the enzymatic hydrolysis of pretreated biomass. The cellulase enzymes facilitate the breakdown of cellulose into glucose, enabling the fermentation process to produce ethanol. This operation ensures a consistent and adequate supply of cellulase enzymes, which are essential for optimizing the hydrolysis process and maximizing ethanol yield.",5
20241209_001652_corn stover_to_ethanol_(5),yeast culture source,"Yeast Culture Source: This unit operation serves as a source for the Yeast Culture stream, which consists of microorganisms specifically cultivated for the fermentation process. The Yeast Culture is essential for converting glucose derived from hydrolyzed biomass into ethanol during the fermentation stage of the process. This operation ensures a consistent and viable supply of yeast, maintaining optimal fermentation conditions to achieve high ethanol yields.",11
20241209_001652_corn stover_to_ethanol_(5),distillation residue sink,"Distillation Residue Sink: This unit operation serves as a sink for the distillation residue stream, which consists of water, unconverted sugars, and microbial biomass. The distillation residue is a byproduct of the ethanol distillation process and is typically directed to waste treatment or further processing for recovery of valuable components.",7
20241209_001652_corn stover_to_ethanol_(5),fuel_grade ethanol sink,"Fuel-Grade Ethanol Sink: This unit operation serves as the final sink for the Fuel-Grade Ethanol stream, which is produced with a purity of at least 99.5%. The ethanol is ready for distribution and blending with gasoline, ensuring it meets the specifications for fuel-grade quality. This sink represents the endpoint of the ethanol production process, where the product is collected and stored for further use.",1
20241209_001652_corn stover_to_ethanol_(6),feedstock_preparation,"Feedstock Preparation: The corn stover feedstock is initially prepared by reducing its size to increase the surface area for subsequent processing. This involves milling the corn stover to achieve a particle size of approximately 1-2 mm. The moisture content, typically around 10-15%, is also adjusted if necessary to optimize the downstream processing efficiency. This preparation step is crucial for enhancing the accessibility of cellulose and hemicellulose during the hydrolysis step.",13
20241209_001652_corn stover_to_ethanol_(6),pretreatment,"Pretreatment: The milled corn stover undergoes a pretreatment process to break down the lignin structure and increase the accessibility of cellulose and hemicellulose for enzymatic hydrolysis. This is typically achieved using a dilute acid or steam explosion method, which helps to solubilize hemicellulose and partially remove lignin. The pretreatment step is critical for improving the efficiency of the enzymatic hydrolysis.",4
20241209_001652_corn stover_to_ethanol_(6),enzymatic_hydrolysis,"Enzymatic Hydrolysis: In this step, the pretreated biomass is subjected to enzymatic hydrolysis where cellulase enzymes break down cellulose into fermentable sugars, primarily glucose. This process is facilitated by the increased accessibility of cellulose achieved during pretreatment. The enzymatic hydrolysis is a key step in converting the solid biomass into a sugar-rich liquid stream suitable for fermentation.",5
