run,unit_op_id,text,cluster_label
20241209_003530_corn stover_to_ethanol_(4),raw corn stover source,"Raw Corn Stover Source: This unit operation serves as the source for the Raw Corn Stover stream, which is collected agricultural residue primarily composed of cellulose (35-40%), hemicellulose (25-30%), and lignin (15-20%). It is typically gathered from agricultural fields post-harvest and requires subsequent handling and preparation to break down its lignocellulosic structure for further processing in the ethanol production pathway.",0
20241209_003530_corn stover_to_ethanol_(4),enzyme source,"Enzyme Source: This unit operation serves as a source for the Enzymes stream, which consists of cellulase and hemicellulase. These enzymes are critical for the enzymatic hydrolysis process, where they catalyze the breakdown of cellulose and hemicellulose from pretreated biomass into fermentable sugars. The Enzyme Source ensures a consistent supply of these biocatalysts, which are essential for optimizing the efficiency of sugar production in the bioethanol process.",5
20241209_003530_corn stover_to_ethanol_(4),fuel_grade ethanol sink,"Fuel-Grade Ethanol Sink: This unit operation serves as the final sink for the Fuel-Grade Ethanol stream, which is a high-purity ethanol suitable for use as a biofuel. The sink collects and stores the ethanol produced from the dehydration process, ensuring that it meets the specifications for fuel-grade ethanol with a purity of 99.5% and a water content of less than 1%. This unit operation is critical for the final product quality assurance and inventory management in the biofuel production process.",1
20241209_003530_corn stover_to_ethanol_(4),lignin residue source,"Lignin Residue Source: This unit operation serves as a source for the Lignin Residue stream, which is the non-fermentable by-product remaining after the enzymatic hydrolysis of pretreated biomass. The Lignin Residue primarily consists of lignin, a complex organic polymer that provides structural support in plants. This stream is generated during the conversion of biomass to sugars and ethanol, and its management is crucial for maximizing overall process efficiency and sustainability. The Lignin Residue can be further processed for recovery of valuable by-products or utilized in waste management systems.",14
20241209_003530_corn stover_to_ethanol_(4),recovered by_products sink,"Recovered By-products Sink: This unit operation serves as the terminus for the Recovered By-products stream, which includes valuable components such as lignin and carbon dioxide. The lignin can be utilized for energy production or as a feedstock in various applications, while the captured carbon dioxide can be used in industrial processes or for enhanced oil recovery. This sink ensures the proper management and utilization of these by-products, contributing to the overall sustainability and efficiency of the process.",8
20241209_003530_corn stover_to_ethanol_(4),water/acid or steam source,"Water/Acid or Steam Source: This unit operation serves as a source for the Water/Acid or Steam stream, which includes the necessary pretreatment agents such as dilute acid or steam. These agents are essential for the pretreatment process, as they help to solubilize hemicellulose and disrupt the lignin matrix in the biomass feedstock, facilitating subsequent enzymatic hydrolysis and fermentation steps.",10
20241209_003530_corn stover_to_ethanol_(4),microorganism source,"Microorganism Source: This unit operation serves as a source for microorganisms, specifically yeast and engineered bacteria, which are essential for the fermentation process. These microorganisms facilitate the conversion of sugars into ethanol and carbon dioxide during fermentation, playing a critical role in the production of fuel-grade ethanol from biomass.",11
20241209_003530_corn stover_to_ethanol_(4),carbon dioxide source,"Carbon Dioxide Source: This unit operation serves as a source for the Carbon Dioxide stream, which is generated as a by-product during the fermentation of sugars in the ethanol production process. The Carbon Dioxide produced can be captured and utilized in the Waste Management and By-product Recovery unit operation, contributing to the overall efficiency and sustainability of the process.",8
20241209_003530_corn stover_to_ethanol_(5),feedstock_preparation,"Feedstock Preparation: The corn stover, a lignocellulosic biomass, is first collected and transported to the processing facility. Here, it undergoes size reduction through mechanical milling to increase the surface area, facilitating more efficient downstream processing. This step is crucial as it prepares the biomass for the subsequent pretreatment process, ensuring uniformity and enhancing the accessibility of cellulose and hemicellulose for enzymatic action.",13
20241209_003530_corn stover_to_ethanol_(5),pretreatment,"Pretreatment: The milled corn stover undergoes a pretreatment process to break down the lignin structure and hemicellulose matrix, making the cellulose more accessible for enzymatic hydrolysis. This is typically achieved using a dilute acid or steam explosion method. The pretreatment disrupts the lignocellulosic structure, releasing hemicellulosic sugars and enhancing the digestibility of cellulose.",4
20241209_003530_corn stover_to_ethanol_(5),enzymatic_hydrolysis,"Enzymatic Hydrolysis: The pretreated biomass is subjected to enzymatic hydrolysis, where cellulase enzymes are added to convert cellulose into fermentable sugars, primarily glucose. This step is critical as it transforms the complex carbohydrates into simple sugars that can be fermented into ethanol. The efficiency of this process depends on enzyme activity and the extent of pretreatment.",5
20241209_003530_corn stover_to_ethanol_(5),fermentation,Fermentation: The hydrolysate is transferred to fermentation tanks where yeast or other microorganisms are added to convert the fermentable sugars into ethanol and carbon dioxide. This biological process is anaerobic and requires careful control of conditions to maximize ethanol yield and minimize by-products.,2
20241209_003530_corn stover_to_ethanol_(5),distillation,"Distillation: The fermentation broth is subjected to distillation to separate ethanol from water and other components. This process involves heating the mixture to vaporize ethanol, which is then condensed into a concentrated form. Distillation is a critical step to achieve the desired ethanol purity for fuel applications.",9
20241209_003530_corn stover_to_ethanol_(5),dehydration,Dehydration: The crude ethanol is further dehydrated to remove residual water and achieve fuel-grade ethanol purity. This is often done using molecular sieves or azeotropic distillation techniques to reach the required 99.5% ethanol purity.,3
20241209_003530_corn stover_to_ethanol_(5),raw corn stover source,"Raw Corn Stover Source: This unit operation serves as the source for the Raw Corn Stover stream, which is collected from agricultural fields. The stream consists of stalks, leaves, and cobs of corn, and is characterized by its composition of cellulose (35-40%), hemicellulose (25-30%), lignin (15-20%), ash (5-10%), and moisture (5-10%). This lignocellulosic biomass is typically used as a feedstock in biofuel production processes and requires subsequent pretreatment to convert complex carbohydrates into fermentable sugars.",0
20241209_003530_corn stover_to_ethanol_(5),cellulase enzymes source,"Cellulase Enzymes Source: This unit operation serves as a source for the Cellulase Enzymes stream, which consists of enzymes that catalyze the breakdown of cellulose into glucose. The Cellulase Enzymes are crucial for the enzymatic hydrolysis stage of the process, enabling the conversion of pretreated biomass into fermentable sugars. This stream is produced at an industrial scale to ensure sufficient enzyme availability for efficient hydrolysis.",5
20241209_003530_corn stover_to_ethanol_(5),yeast culture source,"Yeast Culture Source: This unit operation serves as the source for the Yeast Culture stream, which consists of microorganisms specifically cultivated to ferment sugars into ethanol. The Yeast Culture is essential for the fermentation process, where it converts hydrolysate into ethanol and carbon dioxide. The unit operation ensures a consistent supply of healthy and active yeast cells to optimize fermentation efficiency.",11
20241209_003530_corn stover_to_ethanol_(5),stillage sink,"Stillage Sink: The Stillage Sink is the final unit operation in the process flow that receives the stillage stream, which is a byproduct of the distillation process. This stream contains water, unfermented sugars, and biomass residues. The Stillage Sink serves as a collection point for the stillage, where it can be further processed for potential recovery of residual sugars or managed for waste treatment. This unit operation is crucial for ensuring that the byproducts of the ethanol production process are handled efficiently and sustainably.",7
20241209_003530_corn stover_to_ethanol_(5),fuel_grade ethanol sink,"Fuel-Grade Ethanol Sink: This unit operation serves as the final sink for the Fuel-Grade Ethanol stream, which is produced after the dehydration of crude ethanol. It is designed to receive and store high-purity ethanol (99.5% purity) suitable for use as a biofuel. The sink ensures that the ethanol meets the necessary specifications for fuel applications, adhering to ASTM D4806 standards for ethanol fuel blends. This unit operation is critical for the safe handling and storage of the final product before distribution.",1
20241209_003530_corn stover_to_ethanol_(5),acid or steam source,"Acid or Steam Source: This unit operation serves as a source for the Acid or Steam stream, which is essential for the pretreatment process in biomass conversion. The stream can consist of either dilute sulfuric acid or steam, depending on the pretreatment method employed. The acid or steam is crucial for breaking down the lignin structure and hemicellulose matrix in the biomass, facilitating the disruption of the lignocellulosic structure and enhancing the accessibility of cellulose for subsequent enzymatic hydrolysis.",10
20241209_003530_corn stover_to_ethanol_(5),carbon dioxide sink,"Carbon Dioxide Sink: This unit operation serves as a sink for the carbon dioxide produced during the fermentation process. Carbon dioxide is generated as a by-product when yeast ferments glucose to produce ethanol. This sink is designed to capture and manage the carbon dioxide emissions, preventing their release into the atmosphere and allowing for potential utilization or safe disposal.",8
20241209_003530_corn stover_to_ethanol_(6),feedstock_preparation,"Feedstock Preparation: The corn stover, which is a lignocellulosic biomass, is first collected and transported to the processing facility. In this unit operation, the corn stover is subjected to size reduction using mechanical milling to increase the surface area and improve the efficiency of subsequent processing steps. This step is crucial for enhancing the accessibility of cellulose and hemicellulose for enzymatic hydrolysis.",13
20241209_003530_corn stover_to_ethanol_(6),pretreatment,"Pretreatment: The milled corn stover undergoes a pretreatment process to break down the lignocellulosic structure, making cellulose and hemicellulose more accessible for enzymatic hydrolysis. This is often achieved using dilute acid or steam explosion methods, which help to solubilize hemicellulose and disrupt the lignin structure.",4
20241209_003530_corn stover_to_ethanol_(6),enzymatic_hydrolysis,"Enzymatic Hydrolysis: In this unit operation, the pretreated biomass is subjected to enzymatic hydrolysis. Enzymes such as cellulases and hemicellulases are added to convert cellulose and hemicellulose into fermentable sugars, primarily glucose and xylose. This step is critical for the efficient conversion of biomass into sugars.",5
20241209_003530_corn stover_to_ethanol_(6),fermentation,"Fermentation: The sugar solution is then subjected to fermentation, where microorganisms such as Saccharomyces cerevisiae (yeast) are used to convert the sugars into ethanol and carbon dioxide. This biological process is the core of ethanol production, transforming chemical energy stored in sugars into biofuel.",2
20241209_003530_corn stover_to_ethanol_(6),distillation,Distillation: The fermentation broth is processed through distillation to separate ethanol from the mixture. Distillation exploits the different boiling points of ethanol and water to concentrate ethanol to fuel-grade purity. This step is essential for meeting the specifications for biofuel use.,9
20241209_003530_corn stover_to_ethanol_(6),dehydration,"Dehydration: To achieve the required fuel-grade ethanol purity, the crude ethanol undergoes dehydration. This is often done using molecular sieves or membrane separation technologies to remove residual water, achieving ethanol purity levels of 99% or higher.",3
20241209_003530_corn stover_to_ethanol_(6),waste_management,Waste Management: This unit operation involves the treatment and disposal of waste streams generated throughout the process. The stillage from distillation can be processed to recover valuable by-products or used as animal feed. Wastewater treatment is also conducted to ensure environmental compliance.,6
20241209_003530_corn stover_to_ethanol_(6),raw corn stover source,"Raw Corn Stover Source: This unit operation serves as the source for the Raw Corn Stover stream, which is collected biomass from corn fields. The stream consists of cellulose (35-45%), hemicellulose (25-35%), lignin (15-20%), and ash (5-10%). It is a crucial feedstock for the subsequent processes in the production of ethanol, requiring proper handling and storage to maintain its quality before undergoing feedstock preparation.",0
20241209_003530_corn stover_to_ethanol_(6),enzyme solution source,"Enzyme Solution Source: This unit operation serves as a source for the Enzyme Solution, which is a critical input for the enzymatic hydrolysis process. The Enzyme Solution is composed of cellulase and hemicellulase enzymes that facilitate the breakdown of pretreated biomass into fermentable sugars. This operation ensures a consistent supply of the enzyme mixture, enabling efficient conversion of cellulose and hemicellulose into glucose and xylose, which are essential for subsequent fermentation.",5
20241209_003530_corn stover_to_ethanol_(6),yeast culture source,"Yeast Culture Source: This unit operation serves as a source for the Yeast Culture stream, which consists of the microorganism Saccharomyces cerevisiae. This culture is essential for the fermentation process, where it converts sugars from the Sugar Solution into ethanol. The Yeast Culture is maintained under optimal growth conditions to ensure high viability and fermentation efficiency.",11
20241209_003530_corn stover_to_ethanol_(6),fuel_grade ethanol sink,"Fuel-Grade Ethanol Sink: This unit operation serves as the final sink for the Fuel-Grade Ethanol stream, which is produced through the dehydration of crude ethanol. It is designed to receive high-purity ethanol suitable for use as a biofuel, ensuring that the product meets the necessary specifications for fuel-grade ethanol, including a purity of 95-99% and a water content typically less than 1%. This sink represents the endpoint of the ethanol production process, where the final product is stored or dispatched for distribution.",1
20241209_003530_corn stover_to_ethanol_(6),treated wastewater sink,"Treated Wastewater Sink: This unit operation serves as the final sink for the treated wastewater stream, which consists primarily of water that has undergone treatment to remove contaminants. The treated wastewater is suitable for discharge into the environment or for potential reuse in various applications, ensuring compliance with environmental regulations and sustainability practices.",7
20241209_003530_corn stover_to_ethanol_(6),animal feed sink,"Animal Feed Sink: This unit operation serves as the final sink for the Animal Feed stream, which is a by-product derived from the waste management process of stillage treatment. The Animal Feed consists primarily of yeast biomass and residual sugars, making it a valuable feed source for livestock. This sink ensures proper handling, storage, and potential distribution of the animal feed, contributing to the overall sustainability of the biomass conversion process.",7
20241209_003530_corn stover_to_ethanol_(6),pretreatment reagents source,"Pretreatment Reagents Source: This unit operation serves as a source for the Pretreatment Reagents stream, which includes dilute acid, steam, and water. These reagents are essential for the pretreatment process of biomass, specifically corn stover, to enhance the efficiency of enzymatic hydrolysis by breaking down the lignocellulosic structure. The unit operation ensures a consistent and controlled supply of these chemicals, which are critical for optimizing the subsequent conversion processes in the production of ethanol.",12
20241209_003530_corn stover_to_ethanol_(7),pre-treatment,"Pre-treatment: The pre-treatment unit operation is designed to break down the lignocellulosic structure of corn stover to make cellulose and hemicellulose more accessible for subsequent enzymatic hydrolysis. This involves the use of physical, chemical, or a combination of methods such as steam explosion, acid hydrolysis, or alkaline treatment. The goal is to disrupt the lignin structure and partially hydrolyze hemicellulose, enhancing the digestibility of the biomass.",4
20241209_003530_corn stover_to_ethanol_(7),enzymatic_hydrolysis,"Enzymatic Hydrolysis: In this unit operation, the pre-treated biomass is subjected to enzymatic hydrolysis. Specific enzymes, such as cellulases and hemicellulases, are added to the biomass to convert cellulose and hemicellulose into fermentable sugars, primarily glucose and xylose. This process is typically carried out in large reactors where the conditions are optimized for enzyme activity.",5
20241209_003530_corn stover_to_ethanol_(7),fermentation,"Fermentation: The fermentation unit operation involves converting the fermentable sugars in the hydrolysate into ethanol using microorganisms such as yeast or genetically engineered bacteria. The fermentation is carried out in anaerobic conditions, where the microorganisms metabolize the sugars to produce ethanol and carbon dioxide as by-products.",2
20241209_003530_corn stover_to_ethanol_(7),distillation,"Distillation: Distillation is employed to separate ethanol from the fermentation broth. This process involves heating the broth to vaporize ethanol, which is then condensed and collected as a concentrated product. The distillation column is designed to achieve the desired purity of ethanol, typically around 95% before further dehydration.",9
20241209_003530_corn stover_to_ethanol_(7),dehydration,Dehydration: The dehydration unit operation is used to remove residual water from the crude ethanol to achieve fuel-grade purity. This is typically done using molecular sieves or azeotropic distillation to achieve ethanol purity of at least 99.5%.,3
20241209_003530_corn stover_to_ethanol_(7),denaturing,"Denaturing: In this final unit operation, a small amount of gasoline is added to the ethanol to denature it, making it unfit for human consumption. This step is necessary for ethanol to be used as a fuel additive, complying with regulatory requirements.",3
20241209_003530_corn stover_to_ethanol_(7),raw corn stover source,"Raw Corn Stover Source: This unit operation serves as the source for the Raw Corn Stover stream, which is primarily composed of cellulose (35-40%), hemicellulose (25-30%), and lignin (15-20%). The corn stover is harvested as agricultural residue and has a moisture content ranging from 15-20%. This stream is essential for the subsequent pre-treatment process, where it will undergo treatment to break down its lignocellulosic structure, making the sugars more accessible for enzymatic hydrolysis.",0
20241209_003530_corn stover_to_ethanol_(7),enzyme source,"Enzyme Source: This unit operation serves as a source for the Enzymes stream, which is a mixture of cellulases and hemicellulases. These enzymes are crucial for catalyzing the breakdown of cellulose and hemicellulose during the enzymatic hydrolysis process. The Enzyme Source ensures a consistent supply of high-quality enzymes necessary for efficient conversion of pre-treated biomass into fermentable sugars, ultimately facilitating the production of ethanol.",5
20241209_003530_corn stover_to_ethanol_(7),microorganisms source,"Microorganisms Source: This unit operation serves as a source for the 'Microorganisms' stream, which includes yeast and genetically engineered bacteria. These microorganisms are essential for the fermentation process, converting sugars derived from hydrolysate into ethanol. The unit operation ensures a continuous supply of active microorganisms to maintain optimal fermentation conditions, contributing to the efficiency and yield of ethanol production.",11
20241209_003530_corn stover_to_ethanol_(7),stillage sink,"Stillage Sink: The Stillage Sink is a unit operation designed to receive and manage the stillage stream, which is the residue from the distillation process. This stream primarily contains water, unfermented sugars, and biomass. The Stillage Sink serves as a terminus for the stillage, allowing for further processing or disposal of the residual materials. It plays a crucial role in the overall process by ensuring that the by-products of ethanol production are handled efficiently, minimizing waste and maximizing resource recovery.",7
20241209_003530_corn stover_to_ethanol_(7),gasoline source,"Gasoline Source: This unit operation serves as a source for gasoline, which is used in small quantities to denature ethanol in the denaturing process. The gasoline is delivered to the denaturing unit operation to ensure that the fuel-grade ethanol meets regulatory requirements for denatured fuel. The gasoline component is pure and is supplied at a volumetric scale that aligns with the overall production capacity of the ethanol process.",3
20241209_003530_corn stover_to_ethanol_(7),denatured ethanol sink,"Denatured Ethanol Sink: This unit operation serves as the final sink for the Denatured Ethanol stream, which consists of ethanol mixed with a small amount of gasoline. The Denatured Ethanol is ready for distribution and use as a fuel additive. This sink ensures that the denatured ethanol is properly collected, stored, and prepared for shipment to end-users, maintaining the integrity and quality of the product.",1
20241209_003530_corn stover_to_ethanol_(7),acid/alkali solution source,"Acid/Alkali Solution Source: This unit operation serves as a source for the Acid/Alkali Solution stream, which is essential in the pre-treatment process of corn stover. The Acid/Alkali Solution contains a chemical agent, either an acid or an alkali, mixed with water. This solution is critical for breaking down the lignocellulosic structure of corn stover, enhancing the accessibility of cellulose and hemicellulose for subsequent enzymatic hydrolysis. The unit is designed to deliver the required volume of this solution efficiently, ensuring optimal conditions for the pre-treatment stage of the biomass conversion process.",12
20241209_003530_corn stover_to_ethanol_(7),pre_treatment residue sink,"Pre-treatment Residue Sink: This unit operation serves as a sink for the Pre-treatment Residue generated during the pre-treatment of Corn Stover. The Pre-treatment Residue primarily consists of lignin and residual chemicals that are not utilized in subsequent processing steps. This sink is designed to safely collect and manage the solid waste generated, ensuring that it does not interfere with the downstream processes. Proper handling and disposal of this residue are crucial to maintaining environmental compliance and operational efficiency.",7
20241209_003530_corn stover_to_ethanol_(7),carbon dioxide sink,"Carbon Dioxide Sink: This unit operation serves as a sink for the Carbon Dioxide stream generated during the fermentation process. Carbon dioxide is produced when microorganisms metabolize sugars to produce ethanol. This sink is designed to either release the carbon dioxide into the atmosphere or capture it for potential reuse or sequestration, ensuring that it is accounted for in the overall mass balance of the process.",8
20241209_003530_corn stover_to_ethanol_(8),feedstock_preparation,"Feedstock Preparation: The corn stover, which is a lignocellulosic biomass, is first collected and prepared for processing. This involves size reduction through mechanical milling to increase the surface area and facilitate subsequent chemical reactions. The milled stover is then dried to reduce moisture content, which is crucial for efficient downstream processing.",13
20241209_003530_corn stover_to_ethanol_(8),pretreatment,"Pretreatment: The prepared corn stover undergoes a pretreatment process to break down the lignin structure and make cellulose and hemicellulose more accessible for enzymatic hydrolysis. This is typically achieved using dilute acid pretreatment, where the biomass is treated with a dilute acid solution under controlled conditions.",4
20241209_003530_corn stover_to_ethanol_(8),enzymatic_hydrolysis,"Enzymatic Hydrolysis: In this step, the pretreated biomass is subjected to enzymatic hydrolysis, where specific enzymes are added to convert cellulose and hemicellulose into fermentable sugars such as glucose and xylose. This step is critical for maximizing sugar yield, which directly impacts ethanol production efficiency.",5
