run,unit_op_id,text,cluster_label
20241209_000851_corn stover_to_ethanol_(1),feedstock_handling,"Feedstock Handling: The corn stover, which is a lignocellulosic biomass, is delivered to the processing facility. It is first subjected to size reduction to increase the surface area for subsequent processing steps. This involves mechanical operations such as chopping, grinding, or milling. The reduced-size feedstock is then conveyed to storage silos, ensuring a steady supply for continuous processing.",13
20241209_000851_corn stover_to_ethanol_(1),pretreatment,"Pretreatment: The prepared corn stover undergoes a pretreatment process to break down the lignocellulosic structure, making cellulose and hemicellulose more accessible for enzymatic hydrolysis. This typically involves chemical pretreatment using dilute acid or alkali, or physical methods such as steam explosion. The pretreatment disrupts the lignin structure and partially hydrolyzes hemicellulose into soluble sugars.",4
20241209_000851_corn stover_to_ethanol_(1),enzymatic_hydrolysis,"Enzymatic Hydrolysis: The pretreated biomass is subjected to enzymatic hydrolysis, where cellulase enzymes are added to convert cellulose into fermentable sugars, primarily glucose. This step is critical for maximizing sugar yield, which directly impacts ethanol production efficiency. The reaction is typically carried out in large stirred-tank reactors to ensure thorough mixing and enzyme contact with the substrate.",5
20241209_000851_corn stover_to_ethanol_(1),fermentation,Fermentation: The hydrolysate is transferred to fermentation tanks where yeast or other microorganisms are added to convert the fermentable sugars into ethanol and carbon dioxide. This biological process is carried out under anaerobic conditions. The choice of microorganism and fermentation conditions are optimized to maximize ethanol yield and productivity.,2
20241209_000851_corn stover_to_ethanol_(1),distillation,"Distillation: The fermentation broth is subjected to distillation to separate ethanol from water and other components. This involves heating the mixture to vaporize ethanol, which is then condensed and collected as a concentrated product. Multiple distillation columns may be used to achieve the desired ethanol purity.",9
20241209_000851_corn stover_to_ethanol_(1),dehydration,Dehydration: The crude ethanol is further purified through dehydration to remove residual water and achieve fuel-grade ethanol purity. This is typically done using molecular sieves or azeotropic distillation techniques to achieve ethanol purity of 99.5% or higher.,3
20241209_000851_corn stover_to_ethanol_(1),waste_treatment,"Waste Treatment: The stillage and other waste streams from the process are treated to recover valuable byproducts and minimize environmental impact. This may involve anaerobic digestion to produce biogas, or further processing to recover lignin and other components for use as animal feed or energy production.",6
20241209_000851_corn stover_to_ethanol_(1),corn stover feedstock source,"Corn Stover Feedstock Source: This unit operation serves as the source for the Corn Stover Feedstock stream, which is raw corn stover delivered to the facility. The feedstock consists of a complex mixture of cellulose (35-40%), hemicellulose (25-30%), lignin (15-20%), ash (5-10%), and moisture (5-10%). It is a lignocellulosic biomass that typically requires pretreatment to break down cellulose and hemicellulose into fermentable sugars for further processing in the ethanol production pathway.",0
20241209_000851_corn stover_to_ethanol_(1),fuel_grade ethanol sink,"Fuel-Grade Ethanol Sink: This unit operation serves as the final sink for the Fuel-Grade Ethanol stream, which is produced after the dehydration of crude ethanol. It is designed to receive the high-purity ethanol, ensuring that it meets the required specifications for blending with gasoline or for use in various industrial applications. The unit operation guarantees the safe storage and handling of the ethanol, maintaining its quality and preventing contamination.",1
20241209_000851_corn stover_to_ethanol_(1),treated waste sink,"Treated Waste Sink: This unit operation serves as the final sink for the treated waste stream, which consists of water, biogas, and residual solids. The treated waste is the output from the Waste Treatment unit operation, ensuring that the environmental impact of the process is minimized. This sink is designed to handle the disposal or further processing of the treated waste, facilitating compliance with environmental regulations and promoting sustainable waste management practices.",7
20241209_000851_corn stover_to_ethanol_(1),pretreatment chemicals source,"Pretreatment Chemicals Source: This unit operation serves as a source for the Pretreatment Chemicals stream, which includes dilute acids and alkalis. These chemicals are essential for the pretreatment process, as they help to disrupt the lignin structure and partially hydrolyze hemicellulose in the biomass feedstock. This step is crucial for enhancing the accessibility of cellulose for subsequent enzymatic hydrolysis, ultimately improving the efficiency of the overall conversion process to produce ethanol.",12
20241209_000851_corn stover_to_ethanol_(1),off_gases sink,"Off-gases Sink: This unit operation serves as a sink for the off-gases generated during the pretreatment process. It is designed to capture and manage gaseous byproducts, primarily consisting of carbon dioxide and volatile compounds. The off-gases may be directed to a waste treatment facility for further processing or utilized in energy recovery systems, ensuring minimal environmental impact and compliance with emission regulations.",8
20241209_000851_corn stover_to_ethanol_(1),enzyme addition source,"Enzyme Addition Source: This unit operation serves as a source for the Enzyme Addition stream, which consists of cellulase enzymes. These enzymes are crucial for the enzymatic hydrolysis process, where they catalyze the conversion of cellulose from pretreated biomass into fermentable glucose. The enzymes are supplied in a concentrated form to ensure efficient hydrolysis, enabling the subsequent fermentation step to produce ethanol.",5
20241209_000851_corn stover_to_ethanol_(1),carbon dioxide sink,"Carbon Dioxide Sink: The Carbon Dioxide Sink is a unit operation that serves as the terminus for the carbon dioxide byproduct generated during the fermentation process. This operation collects and manages the carbon dioxide produced when microorganisms convert sugars into ethanol under anaerobic conditions. The sink is designed to ensure safe handling and potential utilization of carbon dioxide, which can be captured for various applications, including enhanced oil recovery or as a feedstock for chemical synthesis.",8
20241209_000851_corn stover_to_ethanol_(1),biogas sink,"Biogas Sink: This unit operation serves as the sink for the biogas produced during the anaerobic digestion process. It is designed to collect and manage the biogas, which primarily consists of methane and carbon dioxide. The biogas can be utilized for energy production, either through combustion for heat and power generation or upgraded to biomethane for use as a renewable natural gas. Proper handling and storage of biogas are essential to ensure safety and efficiency in its utilization.",8
20241209_000851_corn stover_to_ethanol_(10),feedstock_handling_and_preparation,"Feedstock Handling and Preparation: The corn stover, which is a lignocellulosic biomass, is delivered to the processing facility at a volumetric scale of 1000 metric tons per day. The feedstock is first subjected to size reduction using mechanical shredders or grinders to increase the surface area and enhance the efficiency of subsequent pretreatment processes. This step is crucial to ensure uniformity in particle size, which facilitates better penetration of chemicals during pretreatment.",13
20241209_000851_corn stover_to_ethanol_(10),pretreatment,"Pretreatment: The prepared corn stover undergoes a pretreatment process to break down the complex lignocellulosic structure, making cellulose and hemicellulose more accessible for enzymatic hydrolysis. Common pretreatment methods include dilute acid hydrolysis, steam explosion, or alkaline pretreatment. This step disrupts the lignin structure and solubilizes hemicellulose, enhancing the digestibility of the biomass.",4
20241209_000851_corn stover_to_ethanol_(10),enzymatic_hydrolysis,"Enzymatic Hydrolysis: In this unit operation, the pretreated biomass is subjected to enzymatic hydrolysis, where specific enzymes such as cellulases and hemicellulases are added to convert cellulose and hemicellulose into fermentable sugars, primarily glucose and xylose. This step is crucial for maximizing sugar yield, which directly impacts ethanol production efficiency.",5
20241209_000851_corn stover_to_ethanol_(10),fermentation,"Fermentation: The hydrolysate, rich in fermentable sugars, is fed into a fermentation reactor where microorganisms, typically yeast such as Saccharomyces cerevisiae, convert the sugars into ethanol and carbon dioxide. This biological process is the core of ethanol production, and the efficiency of fermentation is critical for achieving high ethanol yields.",2
20241209_000851_corn stover_to_ethanol_(10),distillation,"Distillation: The fermentation broth is subjected to distillation to separate ethanol from the mixture. This unit operation involves heating the broth to vaporize ethanol, which is then condensed into a concentrated form. Distillation is essential for achieving the required ethanol purity for fuel-grade applications.",9
20241209_000851_corn stover_to_ethanol_(10),dehydration,Dehydration: The crude ethanol stream undergoes dehydration to remove residual water and achieve the desired purity level of 95-99% ethanol. This is typically accomplished using molecular sieves or azeotropic distillation techniques. High-purity ethanol is essential for meeting ASTM D4806 specifications for biofuel use.,3
20241209_000851_corn stover_to_ethanol_(10),waste_management_and_by-product_recovery,"Waste Management and By-product Recovery: This unit operation involves the handling and treatment of waste streams generated throughout the process, including stillage and lignin residues. By-products such as lignin can be recovered and utilized for energy generation or as a feedstock for other chemical processes. Efficient waste management is crucial for minimizing environmental impact and improving the overall sustainability of the process.",6
20241209_000851_corn stover_to_ethanol_(10),raw corn stover source,"Raw Corn Stover Source: This unit operation serves as the source for the Raw Corn Stover stream, which is a lignocellulosic biomass composed of cellulose (40-50%), hemicellulose (25-30%), lignin (15-20%), and ash (5-10%). The Raw Corn Stover is delivered at an industrial scale of 1000 metric tons per day, providing the necessary feedstock for subsequent processing steps such as feedstock handling, pretreatment, and enzymatic hydrolysis in the production of ethanol.",0
20241209_000851_corn stover_to_ethanol_(10),enzyme source,"Enzyme Source: This unit operation serves as a source for the enzyme stream, providing a mixture of cellulases and hemicellulases essential for the enzymatic hydrolysis of pretreated biomass. The enzymes facilitate the breakdown of cellulose and hemicellulose into fermentable sugars, which are crucial for the subsequent fermentation process in ethanol production.",5
20241209_000851_corn stover_to_ethanol_(10),yeast culture source,"Yeast Culture Source: This unit operation serves as a source for the Yeast Culture stream, which consists of the microorganism Saccharomyces cerevisiae. This culture is essential for the fermentation process, where it converts sugars present in the hydrolysate into ethanol. The Yeast Culture is prepared and maintained under controlled conditions to ensure optimal fermentation performance, contributing to the overall efficiency and yield of ethanol production.",11
20241209_000851_corn stover_to_ethanol_(10),fuel_grade ethanol sink,"Fuel-Grade Ethanol Sink: This unit operation serves as the final sink for the Fuel-Grade Ethanol stream, which is produced after the dehydration of crude ethanol. It is designed to collect and store high-purity ethanol that meets ASTM D4806 specifications for use as a biofuel. The unit ensures that the ethanol is maintained at the required purity levels, free from water and impurities, and is ready for distribution or further processing.",1
20241209_000851_corn stover_to_ethanol_(10),treated wastewater sink,"Treated Wastewater Sink: This unit operation serves as the final sink for the treated wastewater stream, which has been processed to meet environmental discharge standards. The treated wastewater is collected here before being released into the environment or sent for further treatment. The operation ensures that the water is free from harmful contaminants and complies with regulatory requirements for safe discharge.",7
20241209_000851_corn stover_to_ethanol_(10),lignin by_product sink,"Lignin By-product Sink: This unit operation serves as the terminus for the Lignin By-product stream, which consists of recovered lignin. The lignin can be utilized for energy generation, as a raw material for bioplastics, or in other applications such as adhesives and surfactants. This sink is designed to handle the final disposition of lignin, ensuring proper storage or transfer for further processing or utilization.",14
20241209_000851_corn stover_to_ethanol_(10),pretreatment catalyst/agent source,"Pretreatment Catalyst/Agent Source: This unit operation serves as a source for the Pretreatment Catalyst/Agent stream, which includes various chemical agents such as dilute acids, steam, and alkaline solutions. These agents are essential for the pretreatment process, as they facilitate the breakdown of the lignocellulosic structure in the biomass, enabling the subsequent enzymatic hydrolysis and fermentation stages to convert the biomass into fermentable sugars and ultimately into ethanol.",12
20241209_000851_corn stover_to_ethanol_(10),waste gas sink,"Waste Gas Sink: This unit operation serves as a sink for waste gases generated during the pretreatment process. The waste gases primarily consist of carbon dioxide and volatile organic compounds released from the breakdown of biomass components. This sink is designed to capture and manage these gases, ensuring that they are either treated for environmental compliance or safely vented to the atmosphere, minimizing the impact on the surrounding environment.",8
20241209_000851_corn stover_to_ethanol_(10),carbon dioxide sink,"Carbon Dioxide Sink: This unit operation serves as the terminus for the carbon dioxide stream generated during the fermentation process. It is designed to safely collect and manage the carbon dioxide produced as a by-product when yeast converts fermentable sugars into ethanol. The carbon dioxide sink ensures that the gas is either vented safely to the atmosphere or captured for potential reuse in other processes, thereby minimizing environmental impact and optimizing resource utilization.",8
20241209_000851_corn stover_to_ethanol_(10),water sink,"Water Sink: This unit operation serves as a sink for the water removed during the dehydration process of ethanol production. It collects and manages the water by-product generated to ensure proper disposal or potential reuse, thereby minimizing environmental impact and optimizing resource utilization.",1
20241209_000851_corn stover_to_ethanol_(10),residual solids sink,"Residual Solids Sink: This unit operation serves as a sink for the Residual Solids stream, which includes any remaining solids that are not solubilized or recovered as lignin. The stream consists of unconverted biomass and ash, which may require disposal or further processing depending on their composition. Proper management of this stream is essential to minimize environmental impact and ensure compliance with waste disposal regulations.",7
20241209_000851_corn stover_to_ethanol_(2),feedstock_preparation,"Feedstock Preparation: The corn stover, which is a lignocellulosic biomass, is first collected and transported to the processing facility. In this unit operation, the stover is subjected to size reduction using mechanical milling to increase the surface area, which is crucial for the subsequent pretreatment process. This step ensures uniformity in particle size, which enhances the efficiency of the pretreatment process.",13
20241209_000851_corn stover_to_ethanol_(2),pretreatment,"Pretreatment: The milled corn stover undergoes a pretreatment process designed to break down the complex lignocellulosic structure, making the cellulose and hemicellulose more accessible for enzymatic hydrolysis. This is typically achieved using a dilute acid or steam explosion method, which helps in the removal of lignin and hemicellulose, thus exposing the cellulose fibers.",4
20241209_000851_corn stover_to_ethanol_(2),enzymatic_hydrolysis,"Enzymatic Hydrolysis: In this unit operation, the pretreated biomass is subjected to enzymatic hydrolysis where specific enzymes, such as cellulases and hemicellulases, are added to convert cellulose and hemicellulose into fermentable sugars like glucose and xylose. This step is crucial for maximizing sugar yield, which directly impacts ethanol production efficiency.",5
20241209_000851_corn stover_to_ethanol_(2),fermentation,Fermentation: The sugar solution is transferred to fermentation tanks where yeast or other microorganisms are introduced to convert the sugars into ethanol and carbon dioxide. This biological process is conducted under anaerobic conditions and is a key step in the production of ethanol.,2
20241209_000851_corn stover_to_ethanol_(2),distillation,"Distillation: The fermentation broth is subjected to distillation to separate ethanol from the mixture. This process involves heating the broth to vaporize ethanol, which is then condensed and collected as a concentrated ethanol stream. This step is essential for achieving the desired purity of ethanol for fuel applications.",9
20241209_000851_corn stover_to_ethanol_(2),dehydration,"Dehydration: To achieve fuel-grade ethanol purity, the crude ethanol undergoes dehydration. This is typically done using molecular sieves or azeotropic distillation to remove the remaining water, resulting in ethanol with a purity of 95-99%.",3
20241209_000851_corn stover_to_ethanol_(2),denaturing,"Denaturing: The high-purity ethanol is denatured by adding a small amount of a denaturant, such as gasoline or methanol, to make it unfit for human consumption. This step is necessary for regulatory compliance and to avoid beverage alcohol taxes.",3
20241209_000851_corn stover_to_ethanol_(2),raw corn stover source,"Raw Corn Stover Source: This unit operation serves as the source for the Raw Corn Stover stream, which is collected from agricultural fields. The stream contains a mixture of cellulose (35-40%), hemicellulose (25-30%), lignin (15-20%), ash (5-10%), and moisture (5-15%). It is a lignocellulosic biomass that typically requires pretreatment to break down complex carbohydrates into fermentable sugars for further processing in the ethanol production process.",0
20241209_000851_corn stover_to_ethanol_(2),stillage sink,"Stillage Sink: This unit operation serves as the sink for the Stillage stream, which is the residue from the distillation process. It contains water, yeast biomass, and residual sugars. The Stillage Sink is designed to manage the disposal or further processing of this by-product, ensuring that the components are either treated for environmental compliance or redirected for potential recovery of valuable materials.",7
20241209_000851_corn stover_to_ethanol_(2),denatured ethanol sink,"Denatured Ethanol Sink: This unit operation serves as the final sink for Denatured Ethanol, which is ethanol rendered undrinkable by the addition of a denaturant. The denatured ethanol is prepared for distribution as a biofuel, ensuring it meets the necessary specifications for fuel-grade applications. This unit operation handles the final storage and transfer of denatured ethanol to distribution channels.",1
20241209_000851_corn stover_to_ethanol_(2),pretreatment agent source,"Pretreatment Agent Source: This unit operation serves as a source for the Pretreatment Agent stream, which is essential for the pretreatment process of lignocellulosic biomass. The stream includes components such as dilute acid (e.g., sulfuric acid) and water, which are crucial for breaking down the complex lignocellulosic structure of feedstocks like corn stover. The effective use of this stream enhances the efficiency of subsequent processing steps by ensuring optimal conditions for the pretreatment phase.",12
20241209_000851_corn stover_to_ethanol_(2),pretreatment by_products sink,"Pretreatment By-products Sink: This unit operation serves as a sink for the pretreatment by-products generated during the biomass pretreatment process. It collects and manages the by-products, which may include solubilized hemicellulose, degraded lignin, and other degradation products that are not utilized in the subsequent steps of the ethanol production process. Proper handling and disposal or potential valorization of these by-products are crucial for minimizing waste and maximizing resource efficiency in the overall process.",12
20241209_000851_corn stover_to_ethanol_(2),enzyme solution source,"Enzyme Solution Source: This unit operation serves as a source for the Enzyme Solution stream, which includes essential enzymes such as cellulases and hemicellulases. These enzymes are crucial for catalyzing the hydrolysis of cellulose and hemicellulose into fermentable sugars during the enzymatic hydrolysis process. The Enzyme Solution is prepared to ensure optimal conditions for the enzymatic reactions, facilitating efficient conversion of pretreated biomass into sugars that can be fermented into ethanol.",5
20241209_000851_corn stover_to_ethanol_(2),yeast or microorganism inoculum source,"Yeast or Microorganism Inoculum Source: This unit operation serves as a source for the Yeast or Microorganism Inoculum stream, which is essential for the fermentation process in ethanol production. The inoculum introduces the necessary yeast or other microorganisms that will ferment the sugars derived from the sugar solution into ethanol and carbon dioxide. This operation ensures a consistent and adequate supply of viable microorganisms to optimize fermentation efficiency.",11
20241209_000851_corn stover_to_ethanol_(2),water sink,"Water Sink: This unit operation serves as a sink for the water stream generated during the dehydration process of crude ethanol. It collects the water that is removed to achieve the desired purity of ethanol, ensuring that the process maintains efficient water management and disposal.",1
20241209_000851_corn stover_to_ethanol_(2),denaturant source,"Denaturant Source: This unit operation serves as a source for the denaturant stream, which includes substances like gasoline or methanol. The denaturant is essential for the denaturing process of fuel-grade ethanol, rendering it unfit for human consumption. This operation ensures a continuous supply of denaturant at the required volumetric scale to meet the demands of the denaturing unit operation in the ethanol production process.",3
20241209_000851_corn stover_to_ethanol_(3),feedstock_preparation,"Feedstock Preparation: The corn stover, which is primarily composed of cellulose, hemicellulose, and lignin, is initially prepared for processing. This involves size reduction through milling to achieve a particle size of approximately 1-2 mm, which is optimal for subsequent processing steps. The moisture content is adjusted to around 10-15% to facilitate efficient handling and processing in downstream operations.",13
20241209_000851_corn stover_to_ethanol_(3),pretreatment,"Pretreatment: The prepared corn stover undergoes a pretreatment process to break down the lignin structure and make the cellulose and hemicellulose more accessible for enzymatic hydrolysis. This is typically achieved using a dilute acid or steam explosion method, which helps to disrupt the lignocellulosic matrix.",4
20241209_000851_corn stover_to_ethanol_(3),enzymatic_hydrolysis,"Enzymatic Hydrolysis: In this step, the pretreated biomass is subjected to enzymatic hydrolysis, where cellulase enzymes are used to convert cellulose and hemicellulose into fermentable sugars, primarily glucose and xylose. This process is critical for maximizing sugar yield, which directly impacts ethanol production efficiency.",5
20241209_000851_corn stover_to_ethanol_(3),fermentation,"Fermentation: The sugar solution is then fermented using yeast or genetically engineered microorganisms to convert the sugars into ethanol. This biological process is conducted in large fermenters, where conditions are optimized to maximize ethanol yield and productivity.",2
20241209_000851_corn stover_to_ethanol_(3),distillation,"Distillation: The fermentation broth is subjected to distillation to separate ethanol from the mixture. This involves heating the broth to vaporize ethanol, which is then condensed into a concentrated form. The distillation process is designed to achieve fuel-grade ethanol purity of 99.5%, meeting ASTM D4806 specifications.",9
20241209_000851_corn stover_to_ethanol_(3),dehydration,"Dehydration: The crude ethanol is further dehydrated to remove any remaining water, achieving the required purity of 99.5% for fuel-grade ethanol. This is typically done using molecular sieves or azeotropic distillation techniques.",3
